{
  "schema_version": "rig-benchmark-rust-report/v2",
  "suite_id": "rig-benchmark-rust-v1",
  "suite_state": "QUALIFICATION",
  "truth_digest": "sha256:a58a5ee20b3a959e6e90bce17d7b78eeb56f90e12c68f971e33683715c2c604b",
  "required_categories": 43,
  "required_controls": 172,
  "built_controls": 172,
  "planned_controls": 0,
  "corpus_cases": 172,
  "corpus_complete": true,
  "corpus_executed": true,
  "corpus_runtime_coordinate": "rustc-1.97.1-aarch64-apple-darwin",
  "foundation_cases": 23,
  "passed_foundation_cases": 23,
  "foundation_conformance_passed": true,
  "deterministic_replay_passed": true,
  "hostile_repository_passed": true,
  "resource_budgets_passed": true,
  "ordinary_product_path_passed": false,
  "held_out_applications_passed": false,
  "sealed_transcripts_verified": true,
  "authenticated_readback_verified": true,
  "publication_state": "FINAL",
  "coverage_verdict": "CANNOT_CERTIFY",
  "layers": {
    "language_corpus": "COMPLETE",
    "framework_product": "COMPLETE",
    "hostile_repository": "COMPLETE",
    "held_out_applications": "NOT_RUN"
  },
  "score": {
    "status": "COMPLETE",
    "tp": 43,
    "fp": 0,
    "fn": 0,
    "tn": 43,
    "unknown_controls_passed": 43,
    "unsupported_controls_passed": 43,
    "evidence_grade_mismatches": 0,
    "unresolved": 0,
    "unexpected_observations": 0,
    "passed": false
  },
  "category_scores": [
    {
      "category": "CWE-113",
      "mapping": "DIRECT",
      "required_evidence_grade": "RUNTIME_SEMANTIC",
      "vulnerable": "FINDING",
      "safe": "CLEAN",
      "unknown": "UNKNOWN",
      "unsupported": "UNSUPPORTED",
      "tp": 1,
      "fp": 0,
      "fn": 0,
      "tn": 1,
      "evidence_grade_mismatches": 0,
      "unresolved": 0,
      "passed": true
    },
    {
      "category": "CWE-116",
      "mapping": "DIRECT",
      "required_evidence_grade": "RUNTIME_SEMANTIC",
      "vulnerable": "FINDING",
      "safe": "CLEAN",
      "unknown": "UNKNOWN",
      "unsupported": "UNSUPPORTED",
      "tp": 1,
      "fp": 0,
      "fn": 0,
      "tn": 1,
      "evidence_grade_mismatches": 0,
      "unresolved": 0,
      "passed": true
    },
    {
      "category": "CWE-119",
      "mapping": "ADAPTED",
      "required_evidence_grade": "RUNTIME_MEMORY",
      "vulnerable": "FINDING",
      "safe": "CLEAN",
      "unknown": "UNKNOWN",
      "unsupported": "UNSUPPORTED",
      "tp": 1,
      "fp": 0,
      "fn": 0,
      "tn": 1,
      "evidence_grade_mismatches": 0,
      "unresolved": 0,
      "passed": true
    },
    {
      "category": "CWE-125",
      "mapping": "ADAPTED",
      "required_evidence_grade": "RUNTIME_MEMORY",
      "vulnerable": "FINDING",
      "safe": "CLEAN",
      "unknown": "UNKNOWN",
      "unsupported": "UNSUPPORTED",
      "tp": 1,
      "fp": 0,
      "fn": 0,
      "tn": 1,
      "evidence_grade_mismatches": 0,
      "unresolved": 0,
      "passed": true
    },
    {
      "category": "CWE-1336",
      "mapping": "DIRECT",
      "required_evidence_grade": "RUNTIME_SEMANTIC",
      "vulnerable": "FINDING",
      "safe": "CLEAN",
      "unknown": "UNKNOWN",
      "unsupported": "UNSUPPORTED",
      "tp": 1,
      "fp": 0,
      "fn": 0,
      "tn": 1,
      "evidence_grade_mismatches": 0,
      "unresolved": 0,
      "passed": true
    },
    {
      "category": "CWE-200",
      "mapping": "DIRECT",
      "required_evidence_grade": "RUNTIME_VALUE_FLOW",
      "vulnerable": "FINDING",
      "safe": "CLEAN",
      "unknown": "UNKNOWN",
      "unsupported": "UNSUPPORTED",
      "tp": 1,
      "fp": 0,
      "fn": 0,
      "tn": 1,
      "evidence_grade_mismatches": 0,
      "unresolved": 0,
      "passed": true
    },
    {
      "category": "CWE-201",
      "mapping": "DIRECT",
      "required_evidence_grade": "RUNTIME_VALUE_FLOW",
      "vulnerable": "FINDING",
      "safe": "CLEAN",
      "unknown": "UNKNOWN",
      "unsupported": "UNSUPPORTED",
      "tp": 1,
      "fp": 0,
      "fn": 0,
      "tn": 1,
      "evidence_grade_mismatches": 0,
      "unresolved": 0,
      "passed": true
    },
    {
      "category": "CWE-22",
      "mapping": "DIRECT",
      "required_evidence_grade": "RUNTIME_EFFECT",
      "vulnerable": "FINDING",
      "safe": "CLEAN",
      "unknown": "UNKNOWN",
      "unsupported": "UNSUPPORTED",
      "tp": 1,
      "fp": 0,
      "fn": 0,
      "tn": 1,
      "evidence_grade_mismatches": 0,
      "unresolved": 0,
      "passed": true
    },
    {
      "category": "CWE-284",
      "mapping": "CONTROLLER",
      "required_evidence_grade": "RUNTIME_DIFFERENTIAL",
      "vulnerable": "FINDING",
      "safe": "CLEAN",
      "unknown": "UNKNOWN",
      "unsupported": "UNSUPPORTED",
      "tp": 1,
      "fp": 0,
      "fn": 0,
      "tn": 1,
      "evidence_grade_mismatches": 0,
      "unresolved": 0,
      "passed": true
    },
    {
      "category": "CWE-287",
      "mapping": "CONTROLLER",
      "required_evidence_grade": "RUNTIME_DIFFERENTIAL",
      "vulnerable": "FINDING",
      "safe": "CLEAN",
      "unknown": "UNKNOWN",
      "unsupported": "UNSUPPORTED",
      "tp": 1,
      "fp": 0,
      "fn": 0,
      "tn": 1,
      "evidence_grade_mismatches": 0,
      "unresolved": 0,
      "passed": true
    },
    {
      "category": "CWE-306",
      "mapping": "CONTROLLER",
      "required_evidence_grade": "RUNTIME_DIFFERENTIAL",
      "vulnerable": "FINDING",
      "safe": "CLEAN",
      "unknown": "UNKNOWN",
      "unsupported": "UNSUPPORTED",
      "tp": 1,
      "fp": 0,
      "fn": 0,
      "tn": 1,
      "evidence_grade_mismatches": 0,
      "unresolved": 0,
      "passed": true
    },
    {
      "category": "CWE-328",
      "mapping": "ADAPTED",
      "required_evidence_grade": "RUNTIME_PROPERTY",
      "vulnerable": "FINDING",
      "safe": "CLEAN",
      "unknown": "UNKNOWN",
      "unsupported": "UNSUPPORTED",
      "tp": 1,
      "fp": 0,
      "fn": 0,
      "tn": 1,
      "evidence_grade_mismatches": 0,
      "unresolved": 0,
      "passed": true
    },
    {
      "category": "CWE-330",
      "mapping": "ADAPTED",
      "required_evidence_grade": "RUNTIME_PROPERTY",
      "vulnerable": "FINDING",
      "safe": "CLEAN",
      "unknown": "UNKNOWN",
      "unsupported": "UNSUPPORTED",
      "tp": 1,
      "fp": 0,
      "fn": 0,
      "tn": 1,
      "evidence_grade_mismatches": 0,
      "unresolved": 0,
      "passed": true
    },
    {
      "category": "CWE-352",
      "mapping": "CONTROLLER",
      "required_evidence_grade": "RUNTIME_DIFFERENTIAL",
      "vulnerable": "FINDING",
      "safe": "CLEAN",
      "unknown": "UNKNOWN",
      "unsupported": "UNSUPPORTED",
      "tp": 1,
      "fp": 0,
      "fn": 0,
      "tn": 1,
      "evidence_grade_mismatches": 0,
      "unresolved": 0,
      "passed": true
    },
    {
      "category": "CWE-362",
      "mapping": "CONTROLLER",
      "required_evidence_grade": "RUNTIME_DIFFERENTIAL",
      "vulnerable": "FINDING",
      "safe": "CLEAN",
      "unknown": "UNKNOWN",
      "unsupported": "UNSUPPORTED",
      "tp": 1,
      "fp": 0,
      "fn": 0,
      "tn": 1,
      "evidence_grade_mismatches": 0,
      "unresolved": 0,
      "passed": true
    },
    {
      "category": "CWE-400",
      "mapping": "ADAPTED",
      "required_evidence_grade": "RUNTIME_EFFECT",
      "vulnerable": "FINDING",
      "safe": "CLEAN",
      "unknown": "UNKNOWN",
      "unsupported": "UNSUPPORTED",
      "tp": 1,
      "fp": 0,
      "fn": 0,
      "tn": 1,
      "evidence_grade_mismatches": 0,
      "unresolved": 0,
      "passed": true
    },
    {
      "category": "CWE-416",
      "mapping": "ADAPTED",
      "required_evidence_grade": "RUNTIME_MEMORY",
      "vulnerable": "FINDING",
      "safe": "CLEAN",
      "unknown": "UNKNOWN",
      "unsupported": "UNSUPPORTED",
      "tp": 1,
      "fp": 0,
      "fn": 0,
      "tn": 1,
      "evidence_grade_mismatches": 0,
      "unresolved": 0,
      "passed": true
    },
    {
      "category": "CWE-501",
      "mapping": "DIRECT",
      "required_evidence_grade": "RUNTIME_VALUE_FLOW",
      "vulnerable": "FINDING",
      "safe": "CLEAN",
      "unknown": "UNKNOWN",
      "unsupported": "UNSUPPORTED",
      "tp": 1,
      "fp": 0,
      "fn": 0,
      "tn": 1,
      "evidence_grade_mismatches": 0,
      "unresolved": 0,
      "passed": true
    },
    {
      "category": "CWE-502",
      "mapping": "ADAPTED",
      "required_evidence_grade": "RUNTIME_SEMANTIC",
      "vulnerable": "FINDING",
      "safe": "CLEAN",
      "unknown": "UNKNOWN",
      "unsupported": "UNSUPPORTED",
      "tp": 1,
      "fp": 0,
      "fn": 0,
      "tn": 1,
      "evidence_grade_mismatches": 0,
      "unresolved": 0,
      "passed": true
    },
    {
      "category": "CWE-532",
      "mapping": "DIRECT",
      "required_evidence_grade": "RUNTIME_VALUE_FLOW",
      "vulnerable": "FINDING",
      "safe": "CLEAN",
      "unknown": "UNKNOWN",
      "unsupported": "UNSUPPORTED",
      "tp": 1,
      "fp": 0,
      "fn": 0,
      "tn": 1,
      "evidence_grade_mismatches": 0,
      "unresolved": 0,
      "passed": true
    },
    {
      "category": "CWE-601",
      "mapping": "DIRECT",
      "required_evidence_grade": "RUNTIME_SEMANTIC",
      "vulnerable": "FINDING",
      "safe": "CLEAN",
      "unknown": "UNKNOWN",
      "unsupported": "UNSUPPORTED",
      "tp": 1,
      "fp": 0,
      "fn": 0,
      "tn": 1,
      "evidence_grade_mismatches": 0,
      "unresolved": 0,
      "passed": true
    },
    {
      "category": "CWE-611",
      "mapping": "ADAPTED",
      "required_evidence_grade": "RUNTIME_EFFECT",
      "vulnerable": "FINDING",
      "safe": "CLEAN",
      "unknown": "UNKNOWN",
      "unsupported": "UNSUPPORTED",
      "tp": 1,
      "fp": 0,
      "fn": 0,
      "tn": 1,
      "evidence_grade_mismatches": 0,
      "unresolved": 0,
      "passed": true
    },
    {
      "category": "CWE-614",
      "mapping": "DIRECT",
      "required_evidence_grade": "RUNTIME_PROPERTY",
      "vulnerable": "FINDING",